{
  "id": "synthetic-pest-control-tenant-responsibility-subject-first",
  "text": "A residential lease assigns pest-treatment responsibility to the tenant with the service as the grammatical subject.",
  "pages": [
    {
      "page": 1,
      "text": "Pest control and extermination are the tenant's responsibility during the lease."
    }
  ],
  "annotations": [
    {
      "page": 1,
      "start": 0,
      "end": 79,
      "category": "maintenance",
      "text": "Pest control and extermination are the tenant's responsibility during the lease"
    }
  ],
  "expected": {
    "ruleCategories": ["maintenance"],
    "texasTopics": [],
    "riskBand": "low"
  }
}
