{
  "id": "synthetic-standard",
  "text": "Monthly rent is $1,450 due on the first of each month. Security deposit: $1,450. Late fee of $75 applies after a 3-day grace period.",
  "pages": [
    {
      "page": 1,
      "text": "RESIDENTIAL LEASE AGREEMENT\n\nMonthly rent is $1,450 due on the first of each month. Security deposit: $1,450. Late fee of $75 applies after a 3-day grace period. Tenant shall maintain the premises in good condition. Landlord may enter with reasonable notice of at least 24 hours."
    }
  ],
  "annotations": [
    { "page": 1, "start": 37, "end": 51, "category": "rent", "text": "rent is $1,450" },
    { "page": 1, "start": 84, "end": 108, "category": "deposit", "text": "Security deposit: $1,450" },
    { "page": 1, "start": 110, "end": 160, "category": "fees", "text": "Late fee of $75 applies after a 3-day grace period" },
    { "page": 1, "start": 162, "end": 214, "category": "maintenance", "text": "Tenant shall maintain the premises in good condition" }
  ],
  "expected": {
    "rentAmount": "$1,450",
    "depositAmount": "$1,450",
    "ruleCategories": ["rent", "deposit", "fees", "maintenance"],
    "texasTopics": ["securityDeposit", "lateFees", "landlordEntry"],
    "riskBand": "low"
  }
}
